{
  "meta": {
    "input": "https://www.cian.ru/sale/flat/300000001/",
    "source": "cian",
    "profile": "balance",
    "mode": "full",
    "generated_at": "2026-10-29T21:15:00+03:00",
    "data_gaps": [
      "Криминальная статистика по району не найдена",
      "История переходов прав без выписки ЕГРН неизвестна"
    ]
  },
  "object": {
    "type": "secondary",
    "title": "2-комнатная квартира, 54,3 м²",
    "address": "Москва, ул. Перерва, 52",
    "city": "Москва",
    "district": "Марьино",
    "lat": 55.6526,
    "lon": 37.7363,
    "price": 15900000,
    "area_total": 54.3,
    "area_kitchen": 8.5,
    "rooms": 2,
    "floor": 9,
    "floors_total": 17,
    "year_built": 1998,
    "house_type": "panel",
    "series": "П-44Т",
    "ceiling_m": 2.74,
    "bathroom": "раздельный",
    "condition": "косметический ремонт",
    "windows_to": "двор и улица",
    "listing_url": "https://www.cian.ru/sale/flat/300000001/",
    "listing_published": "2026-08-12",
    "days_on_market": 78,
    "price_history": [
      {
        "date": "2026-08-12",
        "price": 16500000
      },
      {
        "date": "2026-09-20",
        "price": 15900000
      }
    ],
    "description_flags": [
      "один взрослый собственник",
      "более 5 лет в собственности"
    ]
  },
  "criteria": {
    "noise": {
      "score": 5.5,
      "confidence": "medium",
      "summary": "Панель П-44Т: средняя межквартирная звукоизоляция, жильцы жалуются на слышимость соседей и лифта. Ул. Перерва в 90 м даёт около 62 дБ днём на фасад, выходящий на улицу.",
      "pros": [
        "Окна спальни во двор",
        "Перекрытия железобетонные 140 мм"
      ],
      "cons": [
        "Слышимость соседей типична для серии",
        "Половина окон на улицу с автобусным маршрутом",
        "Шахта лифта примыкает к кухне"
      ],
      "evidence": [
        {
          "text": "Отзывы жильцов о слышимости соседей и лифта",
          "source_url": "https://yandex.ru/maps/org/example",
          "source_title": "Яндекс Карты"
        },
        {
          "text": "Расчётный шум от ул. Перерва ~62 дБ (OSM)",
          "source_title": "osm_nearby"
        }
      ],
      "check_in_person": [
        "Прийти вечером в 21–22 ч и послушать стены и лифт",
        "Закрыть окна на улицу и оценить шум",
        "Спросить про соседей сверху"
      ]
    },
    "building": {
      "score": 7.0,
      "confidence": "high",
      "summary": "Дом 1998 года, капремонт лифтов выполнен в 2021, кровля по плану в 2028. УК с умеренным числом жалоб.",
      "pros": [
        "Лифты заменены в 2021",
        "Мусоропровод заварен",
        "Чистые подъезды по отзывам"
      ],
      "cons": [
        "Межпанельные швы требуют ремонта",
        "Парковка во дворе переполнена вечером"
      ],
      "evidence": [
        {
          "text": "Сведения о капремонте",
          "source_url": "https://fkr-mos.ru/",
          "source_title": "ФКР Москвы"
        },
        {
          "text": "Паспорт дома",
          "source_url": "https://dom.gosuslugi.ru/",
          "source_title": "ГИС ЖКХ"
        }
      ],
      "check_in_person": [
        "Осмотреть швы и углы на предмет промерзания",
        "Спросить о протечках с кровли"
      ]
    },
    "legal": {
      "score": 6.5,
      "confidence": "low",
      "summary": "По объявлению один собственник более 5 лет. Без выписки ЕГРН история переходов неизвестна. Обнаружена несогласованная перепланировка кухни.",
      "pros": [
        "Срок владения больше 5 лет",
        "Один взрослый собственник"
      ],
      "cons": [
        "Кухня объединена с комнатой без согласования"
      ],
      "evidence": [
        {
          "text": "Фото планировки в объявлении",
          "source_url": "https://www.cian.ru/sale/flat/300000001/",
          "source_title": "ЦИАН"
        }
      ],
      "check_in_person": [
        "Сверить план БТИ с фактом"
      ]
    },
    "transport": {
      "score": 7.5,
      "confidence": "high",
      "summary": "Метро «Братиславская» в 900 м (11 мин пешком). До центра 35–40 мин на метро. Выезд на МКАД в часы пик загружен.",
      "pros": [
        {
          "text": "Метро в пешей доступности",
          "url": "https://www.openstreetmap.org/"
        },
        "Несколько автобусных маршрутов"
      ],
      "cons": [
        "Пробки на Люблинской утром"
      ],
      "evidence": [
        {
          "text": "Расстояние до метро 900 м (OSM)",
          "source_title": "osm_nearby"
        }
      ],
      "check_in_person": []
    },
    "ecology": {
      "score": 6.0,
      "confidence": "medium",
      "summary": "Рядом нет крупных промзон, но в 2,5 км Люберецкие поля аэрации, при восточном ветре бывает запах.",
      "pros": [
        "Нет ЛЭП и промзон в 500 м"
      ],
      "cons": [
        "Периодический запах от станции аэрации",
        "Магистраль в 90 м"
      ],
      "evidence": [
        {
          "text": "Жалобы на запах в отзывах о районе",
          "source_url": "https://www.mosecom.mos.ru/",
          "source_title": "Мосэкомониторинг"
        }
      ],
      "check_in_person": [
        "Посетить район при восточном ветре"
      ]
    },
    "green": {
      "score": 8.0,
      "confidence": "high",
      "summary": "Парк «Марьинский» в 450 м, набережная Москвы-реки и парк 850-летия Москвы рядом.",
      "pros": [
        "Крупный парк у реки",
        "Зелёный двор"
      ],
      "cons": [],
      "evidence": [
        {
          "text": "Парк в 450 м (OSM)",
          "source_title": "osm_nearby"
        }
      ],
      "check_in_person": []
    },
    "kids": {
      "score": 7.5,
      "confidence": "medium",
      "summary": "Школа № 2122 в 300 м (входит в топ-300 рейтинга ДОгМ), два детских сада в 400 м.",
      "pros": [
        "Школа рядом с хорошим рейтингом",
        "Сады в пешей доступности"
      ],
      "cons": [
        "Школа переполнена, классы до 32 человек"
      ],
      "evidence": [
        {
          "text": "Рейтинг школ Москвы",
          "source_url": "https://www.mos.ru/dogm/",
          "source_title": "ДОгМ"
        }
      ],
      "check_in_person": [
        "Уточнить прикрепление дома к школе"
      ]
    },
    "amenities": {
      "score": 8.5,
      "confidence": "high",
      "summary": "Магазины, поликлиника и ТЦ «Мариэль» в пешей доступности.",
      "pros": [
        "Продукты в 100 м",
        "Поликлиника в 700 м"
      ],
      "cons": [],
      "evidence": [
        {
          "text": "Объекты в радиусе 800 м (OSM)",
          "source_title": "osm_nearby"
        }
      ],
      "check_in_person": []
    },
    "safety": {
      "score": null,
      "confidence": "none",
      "summary": "Достоверной статистики по кварталу не найдено.",
      "pros": [],
      "cons": [],
      "evidence": [],
      "check_in_person": [
        "Поговорить с жильцами у подъезда",
        "Пройти маршрут от метро вечером"
      ]
    },
    "value_liquidity": {
      "score": 6.5,
      "confidence": "medium",
      "summary": "Цена на 4% выше справедливой с учётом торга. Экспозиция 78 дней в пределах нормы. Перепланировка может мешать ипотеке покупателя.",
      "pros": [
        "Типичная планировка, хороший спрос",
        "Цену уже снижали"
      ],
      "cons": [
        "Несогласованная перепланировка",
        "Небольшая переплата"
      ],
      "evidence": [
        {
          "text": "6 аналогов в радиусе 1 км",
          "source_url": "https://www.cian.ru/",
          "source_title": "ЦИАН"
        }
      ],
      "check_in_person": []
    },
    "future": {
      "score": 7.0,
      "confidence": "medium",
      "summary": "Строится станция Бирюлёвской линии в 1,2 км (частично учтена в цене). Рядом нет КРТ-площадок, которые закроют вид.",
      "pros": [
        "Новая станция метро к 2028"
      ],
      "cons": [
        "Расширение ул. Перерва увеличит шум"
      ],
      "evidence": [
        {
          "text": "Ход строительства Бирюлёвской линии",
          "source_url": "https://stroi.mos.ru/",
          "source_title": "Стройкомплекс Москвы"
        }
      ],
      "check_in_person": []
    }
  },
  "red_flags": [
    {
      "id": "unapproved_redevelopment",
      "title": "Несогласованная перепланировка кухни",
      "severity": "major",
      "criterion": "legal",
      "detail": "Объединение кухни с комнатой в доме с газом запрещено без перегородки. Банки откажут в ипотеке, при продаже возможен штраф и предписание вернуть как было.",
      "source_url": "https://www.cian.ru/sale/flat/300000001/"
    },
    {
      "id": "bus_route_noise",
      "title": "Автобусный маршрут под окнами",
      "severity": "minor",
      "criterion": "noise",
      "detail": "Половина окон выходит на улицу с интенсивным движением."
    }
  ],
  "reviews": {
    "house_summary": "Жильцы хвалят лифты и чистоту, жалуются на слышимость и нехватку парковки.",
    "district_summary": "Марьино считают спокойным спальным районом с хорошим парком у реки. Минусы: пробки утром и запах от станции аэрации.",
    "house": [
      {
        "text": "Слышно соседей сверху и шум лифта по ночам",
        "sentiment": "neg",
        "topic": "шум",
        "source": "Яндекс Карты",
        "url": "https://yandex.ru/maps/org/example",
        "date": "2026-03"
      },
      {
        "text": "Новые лифты, в подъездах чисто, УК отвечает быстро",
        "sentiment": "pos",
        "topic": "УК",
        "source": "2ГИС",
        "url": "https://2gis.ru/moscow",
        "date": "2025-11"
      },
      {
        "text": "Вечером негде поставить машину",
        "sentiment": "neg",
        "topic": "парковка",
        "source": "flatinfo",
        "url": "https://www.flatinfo.ru/",
        "date": "2025-06"
      }
    ],
    "district": [
      {
        "text": "Отличная набережная и парк, много места для прогулок с детьми",
        "sentiment": "pos",
        "topic": "зелень",
        "source": "otzovik",